[
  {
    "id": "grammar-v1-f2r-validation",
    "title": "GRAMMAR-V1 f2r Held-Out Validation",
    "status": "published",
    "outcome": "supportive",
    "question": "Do frozen GRAMMAR-V1 substitution families reappear in the first held-out folio using only known slot values?",
    "result": "f2r produced 8/8 clean observed substitution families with zero new slot values.",
    "interpretation": "Supportive evidence that some ATOMS molecular frames recur outside the training folios.",
    "limitations": [
      "Single ATOMS annotator",
      "Small number of observed families",
      "Not a decipherment test"
    ],
    "trainFolios": [
      "f1r",
      "f1v",
      "f47v"
    ],
    "testFolios": [
      "f2r"
    ],
    "commands": [
      "npm.cmd run validate"
    ],
    "reportPath": "research/artifacts/public/grammar-v1-f2r-validation/report.md",
    "dataTablePaths": [
      "research/artifacts/public/grammar-v1-f2r-validation/tables/grammar-v1-vs-f2r-substitution.tsv",
      "research/artifacts/public/grammar-v1-f2r-validation/tables/grammar-v1-vs-f2r-optional.tsv"
    ],
    "sourceScript": "labs/grammar-discovery/scripts/validate-release-v1.js",
    "commit": "a57b727968cf27b0fdcb232cb31ed764bd7e3e49",
    "tag": "reproducible-release-v1",
    "publishedAt": "2026-07-13",
    "sequenceIndex": 1,
    "supersedes": [],
    "supersededBy": [],
    "metrics": {
      "observedSubstitutionFamilies": 8,
      "cleanSubstitutionFamilies": 8,
      "newSlotValues": 0
    }
  },
  {
    "id": "grammar-v1-f2v-prospective-validation",
    "title": "GRAMMAR-V1 f2v Prospective Validation",
    "status": "published",
    "outcome": "supportive",
    "question": "Does the frozen grammar remain compatible with a later folio labeled after GRAMMAR-V1 was frozen?",
    "result": "f2v produced 7/7 clean observed substitution families with zero new slot values.",
    "interpretation": "Supportive prospective compatibility result, bounded by the same annotation and sample-size limits.",
    "limitations": [
      "Single ATOMS annotator",
      "Five-folio corpus",
      "Compatibility does not imply semantic interpretation"
    ],
    "trainFolios": [
      "f1r",
      "f1v",
      "f47v"
    ],
    "testFolios": [
      "f2v"
    ],
    "commands": [
      "npm.cmd run validate"
    ],
    "reportPath": "research/artifacts/public/grammar-v1-f2v-prospective-validation/report.md",
    "dataTablePaths": [
      "research/artifacts/public/grammar-v1-f2v-prospective-validation/tables/grammar-v1-vs-f2v-substitution.tsv",
      "research/artifacts/public/grammar-v1-f2v-prospective-validation/tables/grammar-v1-vs-f2v-optional.tsv"
    ],
    "sourceScript": "labs/grammar-discovery/scripts/validate-release-v1.js",
    "commit": "a57b727968cf27b0fdcb232cb31ed764bd7e3e49",
    "tag": "reproducible-release-v1",
    "publishedAt": "2026-07-13",
    "sequenceIndex": 2,
    "supersedes": [],
    "supersededBy": [],
    "metrics": {
      "observedSubstitutionFamilies": 7,
      "cleanSubstitutionFamilies": 7,
      "newSlotValues": 0
    }
  },
  {
    "id": "null-control-v1",
    "title": "NULL-CONTROL-V1 Broad Slot Simulation",
    "status": "published",
    "outcome": "inconclusive",
    "question": "How often does a broad null model reproduce the clean f2r and f2v grammar result?",
    "result": "No simulation out of 100000 reproduced the joint clean result, but the null was too broad.",
    "interpretation": "Exploratory only: the model allowed structurally implausible slot values and therefore overstated surprise.",
    "limitations": [
      "Over-broad slot inventory",
      "Naive independence estimate not accepted as main p-value"
    ],
    "trainFolios": [
      "f1r",
      "f1v",
      "f47v"
    ],
    "testFolios": [
      "f2r",
      "f2v"
    ],
    "commands": [
      "npm.cmd run null-control:v1"
    ],
    "reportPath": "research/artifacts/public/null-control-v1/report.md",
    "dataTablePaths": [
      "research/artifacts/public/null-control-v1/tables/null-control-family-probabilities.tsv"
    ],
    "sourceScript": "labs/grammar-discovery/scripts/null-control-v1.js",
    "commit": "c1bd90e8e8cb64f2b5bc9c72f50e62719cb533a9",
    "tag": "atoms-eva-regional-v1",
    "publishedAt": "2026-07-13",
    "sequenceIndex": 3,
    "supersedes": [],
    "supersededBy": [
      "null-control-v2-contextual"
    ],
    "metrics": {
      "simulations": 100000,
      "jointHits": 0
    }
  },
  {
    "id": "null-control-v2-contextual",
    "title": "NULL-CONTROL-V2 Contextual Slot Simulation",
    "status": "published",
    "outcome": "negative",
    "question": "Does the clean grammar result remain rare after preserving local context?",
    "result": "The contextual empirical probability was approximately 0.099090.",
    "interpretation": "Negative result for the strongest grammar claim: local syntax explains much of the apparent slot compatibility.",
    "limitations": [
      "Still one family of null models",
      "Depends on observed local contexts",
      "Does not test visual annotation quality"
    ],
    "trainFolios": [
      "f1r",
      "f1v",
      "f47v"
    ],
    "testFolios": [
      "f2r",
      "f2v"
    ],
    "commands": [
      "npm.cmd run null-control:v2"
    ],
    "reportPath": "research/artifacts/public/null-control-v2-contextual/report.md",
    "dataTablePaths": [
      "research/artifacts/public/null-control-v2-contextual/tables/null-control-v2-contextual-family-probabilities.tsv"
    ],
    "sourceScript": "labs/grammar-discovery/scripts/null-control-v2-contextual.js",
    "commit": "c1bd90e8e8cb64f2b5bc9c72f50e62719cb533a9",
    "tag": "atoms-eva-regional-v1",
    "publishedAt": "2026-07-13",
    "sequenceIndex": 4,
    "supersedes": [
      "null-control-v1"
    ],
    "supersededBy": [],
    "metrics": {
      "contextualEmpiricalProbability": 0.09909
    }
  },
  {
    "id": "null-control-v3-model-comparison",
    "title": "NULL-CONTROL-V3 Full Frame vs Local Context",
    "status": "published",
    "outcome": "negative",
    "question": "Does exact frozen frame identity improve held-out prediction beyond local context?",
    "result": "The exact frame model was slightly worse than local context on combined held-out log-loss.",
    "interpretation": "GRAMMAR-V1 remains descriptive, but its exact frame identity did not add predictive value beyond local syntax.",
    "limitations": [
      "Same held-out folios",
      "Same ATOMS annotation source",
      "Does not evaluate alternate grammar definitions"
    ],
    "trainFolios": [
      "f1r",
      "f1v",
      "f47v"
    ],
    "testFolios": [
      "f2r",
      "f2v"
    ],
    "commands": [
      "npm.cmd run null-control:v3",
      "npm.cmd run null-control:v3:diagnostics"
    ],
    "reportPath": "research/artifacts/public/null-control-v3-model-comparison/report.md",
    "dataTablePaths": [
      "research/artifacts/public/null-control-v3-model-comparison/tables/null-control-v3-opportunities.tsv"
    ],
    "sourceScript": "labs/grammar-discovery/scripts/null-control-v3-model-comparison.js",
    "commit": "c1bd90e8e8cb64f2b5bc9c72f50e62719cb533a9",
    "tag": "atoms-eva-regional-v1",
    "publishedAt": "2026-07-13",
    "sequenceIndex": 5,
    "supersedes": [],
    "supersededBy": [],
    "metrics": {
      "localContextLogLoss": 1.149743,
      "fullFrameLogLoss": 1.214627
    }
  },
  {
    "id": "representation-comparison-v1",
    "title": "REPRESENTATION-COMPARISON-V1 Molecule-Paired Pilot",
    "status": "published",
    "outcome": "inconclusive",
    "question": "Can directly paired molecule-level EVA and ATOMS rows decide representation quality?",
    "result": "Coverage was too low: only 14 of 161 test molecules were paired.",
    "interpretation": "The pilot exposed the alignment problem and should not be used as the global EVA-vs-ATOMS result.",
    "limitations": [
      "Very low paired coverage",
      "Not a regional alignment",
      "Insufficient for global comparison"
    ],
    "trainFolios": [
      "f1r",
      "f1v",
      "f47v"
    ],
    "testFolios": [
      "f2r",
      "f2v"
    ],
    "commands": [
      "npm.cmd run representation-comparison:v1"
    ],
    "reportPath": "research/artifacts/public/representation-comparison-v1/report.md",
    "dataTablePaths": [
      "research/artifacts/public/representation-comparison-v1/tables/representation-comparison-summary.tsv"
    ],
    "sourceScript": "labs/grammar-discovery/scripts/representation-comparison-v1.js",
    "commit": "c1bd90e8e8cb64f2b5bc9c72f50e62719cb533a9",
    "tag": "atoms-eva-regional-v1",
    "publishedAt": "2026-07-13",
    "sequenceIndex": 6,
    "supersedes": [],
    "supersededBy": [
      "representation-comparison-v2-regions"
    ],
    "metrics": {
      "pairedCoverage": 14,
      "testMolecules": 161
    }
  },
  {
    "id": "representation-alignment-v1",
    "title": "REPRESENTATION-ALIGNMENT-V1 Regional Alignment",
    "status": "published",
    "outcome": "methodological",
    "question": "Can EVA and ATOMS be compared over shared manuscript regions without assuming one-to-one token identity?",
    "result": "The alignment produced 209 aligned regions, 15 unresolved regions, 100% ATOMS coverage, and zero crossing alignments.",
    "interpretation": "Methodological bridge enabling regional EVA-vs-ATOMS comparison; not proof of exact token boundaries.",
    "limitations": [
      "Approximate EVA spans",
      "Regional not token-exact",
      "Depends on current folio mapping"
    ],
    "trainFolios": [
      "f1r",
      "f1v",
      "f47v"
    ],
    "testFolios": [
      "f2r",
      "f2v"
    ],
    "commands": [
      "npm.cmd run representation-alignment:v1"
    ],
    "reportPath": "research/artifacts/public/representation-alignment-v1/report.md",
    "dataTablePaths": [
      "research/artifacts/public/representation-alignment-v1/tables/aligned-regions.tsv",